path,title,main_keyword,slug,word_count
content/dog-care/01-how-to-stop-puppy-biting-at-3-months.md,"How to Stop Puppy Biting at 3 Months","how to stop puppy biting at 3 months",how-to-stop-puppy-biting-at-3-months,1351
content/dog-care/02-best-daily-routine-for-senior-dog-with-arthritis.md,"Best Daily Routine for a Senior Dog with Arthritis","best daily routine for senior dog with arthritis",best-daily-routine-for-senior-dog-with-arthritis,1347
content/dog-care/03-how-often-should-you-bathe-a-golden-retriever.md,"How Often Should You Bathe a Golden Retriever?","how often should you bathe a golden retriever",how-often-should-you-bathe-a-golden-retriever,1339
content/dog-care/04-home-remedies-for-dog-itchy-paws-after-walks.md,"Home Remedies for Dog Itchy Paws After Walks","home remedies for dog itchy paws after walks",home-remedies-for-dog-itchy-paws-after-walks,1340
content/dog-care/05-how-to-clean-dog-ears-at-home-safely.md,"How to Clean Dog Ears at Home Safely","how to clean dog ears at home safely",how-to-clean-dog-ears-at-home-safely,1351
content/dog-care/06-crate-training-schedule-for-working-dog-owners.md,"Crate Training Schedule for Working Dog Owners","crate training schedule for working dog owners",crate-training-schedule-for-working-dog-owners,1318
content/dog-care/07-how-to-reduce-dog-shedding-in-apartment.md,"How to Reduce Dog Shedding in an Apartment","how to reduce dog shedding in apartment",how-to-reduce-dog-shedding-in-apartment,1319
content/dog-care/08-best-way-to-remove-dog-urine-smell-from-carpet.md,"Best Way to Remove Dog Urine Smell from Carpet","best way to remove dog urine smell from carpet",best-way-to-remove-dog-urine-smell-from-carpet,1394
content/dog-care/09-how-to-calm-dog-during-thunderstorms-naturally.md,"How to Calm a Dog During Thunderstorms Naturally","how to calm dog during thunderstorms naturally",how-to-calm-dog-during-thunderstorms-naturally,1319
content/dog-care/10-best-tick-prevention-for-dogs-in-backyard.md,"Best Tick Prevention for Dogs in Backyards","best tick prevention for dogs in backyard",best-tick-prevention-for-dogs-in-backyard,1308
content/dog-care/11-how-to-stop-puppy-whining-in-crate-at-night.md,"How to stop puppy whining in crate at night","how to stop puppy whining in crate at night",how-to-stop-puppy-whining-in-crate-at-night,1292
content/dog-care/12-best-brushing-schedule-for-short-hair-dogs.md,"Best brushing schedule for short hair dogs","best brushing schedule for short hair dogs",best-brushing-schedule-for-short-hair-dogs,1249
content/dog-care/13-how-to-clean-dog-paws-after-rainy-walks.md,"How to clean dog paws after rainy walks","how to clean dog paws after rainy walks",how-to-clean-dog-paws-after-rainy-walks,1271
content/dog-care/14-dog-bath-routine-for-sensitive-skin.md,"Dog bath routine for sensitive skin","dog bath routine for sensitive skin",dog-bath-routine-for-sensitive-skin,1220
content/dog-care/15-how-to-trim-black-dog-nails-safely.md,"How to trim black dog nails safely","how to trim black dog nails safely",how-to-trim-black-dog-nails-safely,1242
content/dog-care/16-remove-tear-stains-on-white-dogs-at-home.md,"Remove tear stains on white dogs at home","remove tear stains on white dogs at home",remove-tear-stains-on-white-dogs-at-home,1266
content/dog-care/17-how-to-deodorize-smelly-dog-bed-naturally.md,"How to deodorize smelly dog bed naturally","how to deodorize smelly dog bed naturally",how-to-deodorize-smelly-dog-bed-naturally,1249
content/dog-care/18-dog-grooming-checklist-for-beginners.md,"Dog grooming checklist for beginners","dog grooming checklist for beginners",dog-grooming-checklist-for-beginners,1201
content/dog-care/19-how-to-remove-dog-mats-behind-ears.md,"How to remove dog mats behind ears","how to remove dog mats behind ears",how-to-remove-dog-mats-behind-ears,1244
content/dog-care/20-best-paw-balm-routine-for-winter-dogs.md,"Best paw balm routine for winter dogs","best paw balm routine for winter dogs",best-paw-balm-routine-for-winter-dogs,1249
content/dog-care/21-how-to-cool-down-dogs-in-hot-weather.md,"How to cool down dogs in hot weather","how to cool down dogs in hot weather",how-to-cool-down-dogs-in-hot-weather,1266
content/dog-care/22-dog-travel-bag-checklist-for-weekend-trips.md,"Dog travel bag checklist for weekend trips","dog travel bag checklist for weekend trips",dog-travel-bag-checklist-for-weekend-trips,1244
content/dog-care/23-how-to-clean-dog-toys-and-bowls-safely.md,"How to clean dog toys and bowls safely","how to clean dog toys and bowls safely",how-to-clean-dog-toys-and-bowls-safely,1271
content/dog-care/24-stop-dog-from-drinking-dirty-puddle-water.md,"Stop dog from drinking dirty puddle water","stop dog from drinking dirty puddle water",stop-dog-from-drinking-dirty-puddle-water,1247
content/dog-care/25-dog-parasite-prevention-routine-at-home.md,"Dog parasite prevention routine at home","dog parasite prevention routine at home",dog-parasite-prevention-routine-at-home,1218
content/dog-care/26-how-to-check-dog-ears-for-infection-signs.md,"How to check dog ears for infection signs","how to check dog ears for infection signs",how-to-check-dog-ears-for-infection-signs,1271
content/dog-care/27-best-home-routine-for-dog-seasonal-shedding.md,"Best home routine for dog seasonal shedding","best home routine for dog seasonal shedding",best-home-routine-for-dog-seasonal-shedding,1244
content/dog-care/28-how-to-prevent-dog-paw-burns-on-hot-pavement.md,"How to prevent dog paw burns on hot pavement","how to prevent dog paw burns on hot pavement",how-to-prevent-dog-paw-burns-on-hot-pavement,1297
content/dog-care/29-dog-bedtime-routine-for-better-sleep.md,"Dog bedtime routine for better sleep","dog bedtime routine for better sleep",dog-bedtime-routine-for-better-sleep,1218
content/dog-care/30-how-to-make-vet-visits-less-stressful-for-dogs.md,"How to make vet visits less stressful for dogs","how to make vet visits less stressful for dogs",how-to-make-vet-visits-less-stressful-for-dogs,1299
content/dog-care/31-dog-dental-care-without-anesthesia-tips.md,"Dog dental care without anesthesia tips","dog dental care without anesthesia tips",dog-dental-care-without-anesthesia-tips,1225
content/dog-care/32-how-to-wash-a-fearful-dog-without-stress.md,"How to wash a fearful dog without stress","how to wash a fearful dog without stress",how-to-wash-a-fearful-dog-without-stress,1266
content/dog-care/33-best-flea-comb-routine-for-dogs.md,"Best flea comb routine for dogs","best flea comb routine for dogs",best-flea-comb-routine-for-dogs,1225
content/dog-care/34-how-to-care-for-dogs-after-neuter-surgery.md,"How to care for dogs after neuter surgery","how to care for dogs after neuter surgery",how-to-care-for-dogs-after-neuter-surgery,1271
content/dog-care/35-dog-cone-alternatives-after-surgery-at-home.md,"Dog cone alternatives after surgery at home","dog cone alternatives after surgery at home",dog-cone-alternatives-after-surgery-at-home,1249
content/dog-care/36-how-to-protect-dogs-from-cold-weather-walks.md,"How to protect dogs from cold weather walks","how to protect dogs from cold weather walks",how-to-protect-dogs-from-cold-weather-walks,1271
content/dog-care/37-best-humidifier-setup-for-dogs-with-dry-skin.md,"Best humidifier setup for dogs with dry skin","best humidifier setup for dogs with dry skin",best-humidifier-setup-for-dogs-with-dry-skin,1273
content/dog-care/38-how-to-clean-dog-eyes-for-tear-buildup.md,"How to clean dog eyes for tear buildup","how to clean dog eyes for tear buildup",how-to-clean-dog-eyes-for-tear-buildup,1268
content/dog-care/39-dog-hygiene-routine-for-multi-dog-households.md,"Dog hygiene routine for multi dog households","dog hygiene routine for multi dog households",dog-hygiene-routine-for-multi-dog-households,1247
content/dog-care/40-how-to-stop-dog-from-chewing-leash-on-walks.md,"How to stop dog from chewing leash on walks","how to stop dog from chewing leash on walks",how-to-stop-dog-from-chewing-leash-on-walks,1297
content/dog-care/41-best-crate-setup-for-anxious-rescue-dogs.md,"Best crate setup for anxious rescue dogs","best crate setup for anxious rescue dogs",best-crate-setup-for-anxious-rescue-dogs,1247
content/dog-care/42-how-to-make-homemade-dog-paw-soak.md,"How to make homemade dog paw soak","how to make homemade dog paw soak",how-to-make-homemade-dog-paw-soak,1249
content/dog-care/43-dog-coat-care-routine-for-double-coated-breeds.md,"Dog coat care routine for double coated breeds","dog coat care routine for double coated breeds",dog-coat-care-routine-for-double-coated-breeds,1273
content/dog-care/44-how-often-to-change-dog-water-bowl-daily.md,"How often to change dog water bowl daily","how often to change dog water bowl daily",how-often-to-change-dog-water-bowl-daily,1273
content/dog-care/45-best-dog-safe-cleaning-products-for-floors.md,"Best dog-safe cleaning products for floors","best dog-safe cleaning products for floors",best-dog-safe-cleaning-products-for-floors,1242
content/dog-care/46-how-to-reduce-dog-smell-in-small-apartments.md,"How to reduce dog smell in small apartments","how to reduce dog smell in small apartments",how-to-reduce-dog-smell-in-small-apartments,1275
content/dog-care/47-dog-rain-day-indoor-routine-for-energy-release.md,"Dog rain day indoor routine for energy release","dog rain day indoor routine for energy release",dog-rain-day-indoor-routine-for-energy-release,1271
content/dog-care/48-how-to-prevent-dog-ear-moisture-after-baths.md,"How to prevent dog ear moisture after baths","how to prevent dog ear moisture after baths",how-to-prevent-dog-ear-moisture-after-baths,1266
content/dog-care/49-best-way-to-dry-dog-after-swimming.md,"Best way to dry dog after swimming","best way to dry dog after swimming",best-way-to-dry-dog-after-swimming,1249
content/dog-care/50-dog-first-week-at-home-checklist.md,"Dog first week at home checklist","dog first week at home checklist",dog-first-week-at-home-checklist,1225
content/cat-care/01-how-to-stop-cat-from-scratching-furniture-at-night.md,"How to Stop a Cat from Scratching Furniture at Night","how to stop cat from scratching furniture at night",how-to-stop-cat-from-scratching-furniture-at-night,1380
content/cat-care/02-kitten-litter-training-in-small-apartment.md,"Kitten Litter Training in a Small Apartment","kitten litter training in small apartment",kitten-litter-training-in-small-apartment,1279
content/cat-care/03-best-ways-to-reduce-cat-hairballs-naturally.md,"Best Ways to Reduce Cat Hairballs Naturally","best ways to reduce cat hairballs naturally",best-ways-to-reduce-cat-hairballs-naturally,1310
content/cat-care/04-how-to-introduce-new-cat-to-resident-cat-slowly.md,"How to Introduce a New Cat to a Resident Cat Slowly","how to introduce new cat to resident cat slowly",how-to-introduce-new-cat-to-resident-cat-slowly,1384
content/cat-care/05-cat-not-drinking-water-what-to-do.md,"Cat Not Drinking Water: What to Do First","cat not drinking water what to do",cat-not-drinking-water-what-to-do,1318
content/cat-care/06-how-to-clean-cat-ears-without-stress.md,"How to Clean Cat Ears Without Stress","how to clean cat ears without stress",how-to-clean-cat-ears-without-stress,1323
content/cat-care/07-indoor-enrichment-ideas-for-bored-cats.md,"Indoor Enrichment Ideas for Bored Cats","indoor enrichment ideas for bored cats",indoor-enrichment-ideas-for-bored-cats,1285
content/cat-care/08-best-routine-for-senior-cat-grooming-at-home.md,"Best Grooming Routine for Senior Cats at Home","best routine for senior cat grooming at home",best-routine-for-senior-cat-grooming-at-home,1344
content/cat-care/09-how-to-trim-cat-nails-for-beginners.md,"How to Trim Cat Nails for Beginners","how to trim cat nails for beginners",how-to-trim-cat-nails-for-beginners,1319
content/cat-care/10-how-to-travel-with-cat-in-car-without-stress.md,"How to Travel with a Cat in a Car Without Stress","how to travel with cat in car without stress",how-to-travel-with-cat-in-car-without-stress,1388
content/cat-care/11-how-to-stop-cat-meowing-at-night-for-food.md,"How to stop cat meowing at night for food","how to stop cat meowing at night for food",how-to-stop-cat-meowing-at-night-for-food,1297
content/cat-care/12-best-litter-box-setup-for-small-apartments.md,"Best litter box setup for small apartments","best litter box setup for small apartments",best-litter-box-setup-for-small-apartments,1249
content/cat-care/13-how-to-clean-cat-litter-box-without-odor.md,"How to clean cat litter box without odor","how to clean cat litter box without odor",how-to-clean-cat-litter-box-without-odor,1267
content/cat-care/14-cat-grooming-routine-for-long-hair-cats.md,"Cat grooming routine for long hair cats","cat grooming routine for long hair cats",cat-grooming-routine-for-long-hair-cats,1247
content/cat-care/15-how-to-brush-a-cat-that-hates-brushing.md,"How to brush a cat that hates brushing","how to brush a cat that hates brushing",how-to-brush-a-cat-that-hates-brushing,1265
content/cat-care/16-best-way-to-remove-cat-urine-smell-from-couch.md,"Best way to remove cat urine smell from couch","best way to remove cat urine smell from couch",best-way-to-remove-cat-urine-smell-from-couch,1298
content/cat-care/17-how-to-trim-cat-nails-without-being-scratched.md,"How to trim cat nails without being scratched","how to trim cat nails without being scratched",how-to-trim-cat-nails-without-being-scratched,1267
content/cat-care/18-cat-hydration-tricks-for-picky-drinkers.md,"Cat hydration tricks for picky drinkers","cat hydration tricks for picky drinkers",cat-hydration-tricks-for-picky-drinkers,1225
content/cat-care/19-how-to-clean-cat-eyes-safely-at-home.md,"How to clean cat eyes safely at home","how to clean cat eyes safely at home",how-to-clean-cat-eyes-safely-at-home,1271
content/cat-care/20-best-carrier-training-plan-for-nervous-cats.md,"Best carrier training plan for nervous cats","best carrier training plan for nervous cats",best-carrier-training-plan-for-nervous-cats,1249
content/cat-care/21-how-to-reduce-cat-shedding-in-spring.md,"How to reduce cat shedding in spring","how to reduce cat shedding in spring",how-to-reduce-cat-shedding-in-spring,1243
content/cat-care/22-cat-safe-houseplants-for-indoor-homes.md,"Cat-safe houseplants for indoor homes","cat-safe houseplants for indoor homes",cat-safe-houseplants-for-indoor-homes,1218
content/cat-care/23-how-to-stop-cat-from-biting-during-petting.md,"How to stop cat from biting during petting","how to stop cat from biting during petting",how-to-stop-cat-from-biting-during-petting,1265
content/cat-care/24-best-cat-tree-placement-in-small-rooms.md,"Best cat tree placement in small rooms","best cat tree placement in small rooms",best-cat-tree-placement-in-small-rooms,1250
content/cat-care/25-how-to-introduce-kitten-to-litter-box-quickly.md,"How to introduce kitten to litter box quickly","how to introduce kitten to litter box quickly",how-to-introduce-kitten-to-litter-box-quickly,1274
content/cat-care/26-cat-play-schedule-for-single-indoor-cats.md,"Cat play schedule for single indoor cats","cat play schedule for single indoor cats",cat-play-schedule-for-single-indoor-cats,1249
content/cat-care/27-how-to-calm-cat-during-fireworks-and-storms.md,"How to calm cat during fireworks and storms","how to calm cat during fireworks and storms",how-to-calm-cat-during-fireworks-and-storms,1271
content/cat-care/28-best-way-to-clean-cat-toys-and-bowls.md,"Best way to clean cat toys and bowls","best way to clean cat toys and bowls",best-way-to-clean-cat-toys-and-bowls,1273
content/cat-care/29-how-to-help-senior-cat-groom-less-often.md,"How to help senior cat groom less often","how to help senior cat groom less often",how-to-help-senior-cat-groom-less-often,1274
content/cat-care/30-cat-scratching-post-training-for-new-owners.md,"Cat scratching post training for new owners","cat scratching post training for new owners",cat-scratching-post-training-for-new-owners,1249
content/cat-care/31-how-to-stop-cat-from-waking-you-up-early.md,"How to stop cat from waking you up early","how to stop cat from waking you up early",how-to-stop-cat-from-waking-you-up-early,1296
content/cat-care/32-best-home-setup-for-shy-rescue-cats.md,"Best home setup for shy rescue cats","best home setup for shy rescue cats",best-home-setup-for-shy-rescue-cats,1250
content/cat-care/33-how-to-reduce-hairballs-in-long-haired-cats.md,"How to reduce hairballs in long-haired cats","how to reduce hairballs in long-haired cats",how-to-reduce-hairballs-in-long-haired-cats,1267
content/cat-care/34-cat-travel-checklist-for-vet-appointments.md,"Cat travel checklist for vet appointments","cat travel checklist for vet appointments",cat-travel-checklist-for-vet-appointments,1218
content/cat-care/35-how-to-keep-cat-off-kitchen-counters-gently.md,"How to keep cat off kitchen counters gently","how to keep cat off kitchen counters gently",how-to-keep-cat-off-kitchen-counters-gently,1271
content/cat-care/36-best-feeding-station-setup-for-two-cats.md,"Best feeding station setup for two cats","best feeding station setup for two cats",best-feeding-station-setup-for-two-cats,1249
content/cat-care/37-how-to-make-cat-carrier-feel-safe.md,"How to make cat carrier feel safe","how to make cat carrier feel safe",how-to-make-cat-carrier-feel-safe,1250
content/cat-care/38-cat-litter-tracking-solutions-for-hardwood-floors.md,"Cat litter tracking solutions for hardwood floors","cat litter tracking solutions for hardwood floors",cat-litter-tracking-solutions-for-hardwood-floors,1247
content/cat-care/39-how-to-clean-cat-ears-with-minimal-stress.md,"How to clean cat ears with minimal stress","how to clean cat ears with minimal stress",how-to-clean-cat-ears-with-minimal-stress,1265
content/cat-care/40-best-cat-calming-routine-before-guests-arrive.md,"Best cat calming routine before guests arrive","best cat calming routine before guests arrive",best-cat-calming-routine-before-guests-arrive,1250
content/cat-care/41-how-to-handle-cat-zoomies-at-night.md,"How to handle cat zoomies at night","how to handle cat zoomies at night",how-to-handle-cat-zoomies-at-night,1243
content/cat-care/42-cat-window-perch-safety-tips-for-apartments.md,"Cat window perch safety tips for apartments","cat window perch safety tips for apartments",cat-window-perch-safety-tips-for-apartments,1249
content/cat-care/43-how-to-keep-cat-entertained-while-at-work.md,"How to keep cat entertained while at work","how to keep cat entertained while at work",how-to-keep-cat-entertained-while-at-work,1266
content/cat-care/44-best-routine-for-introducing-new-cat-furniture.md,"Best routine for introducing new cat furniture","best routine for introducing new cat furniture",best-routine-for-introducing-new-cat-furniture,1249
content/cat-care/45-how-to-stop-kitten-from-chewing-wires.md,"How to stop kitten from chewing wires","how to stop kitten from chewing wires",how-to-stop-kitten-from-chewing-wires,1250
content/cat-care/46-cat-sleeping-area-setup-for-colder-weather.md,"Cat sleeping area setup for colder weather","cat sleeping area setup for colder weather",cat-sleeping-area-setup-for-colder-weather,1247
content/cat-care/47-how-to-reduce-cat-dandruff-at-home.md,"How to reduce cat dandruff at home","how to reduce cat dandruff at home",how-to-reduce-cat-dandruff-at-home,1248
content/cat-care/48-best-grooming-tools-for-sensitive-skin-cats.md,"Best grooming tools for sensitive skin cats","best grooming tools for sensitive skin cats",best-grooming-tools-for-sensitive-skin-cats,1250
content/cat-care/49-how-to-build-confidence-in-fearful-cats.md,"How to build confidence in fearful cats","how to build confidence in fearful cats",how-to-build-confidence-in-fearful-cats,1250
content/cat-care/50-cat-first-month-at-home-care-checklist.md,"Cat first month at home care checklist","cat first month at home care checklist",cat-first-month-at-home-care-checklist,1247
content/pet-health/01-early-signs-of-dental-disease-in-dogs-and-cats.md,"Early Signs of Dental Disease in Dogs and Cats","early signs of dental disease in dogs and cats",early-signs-of-dental-disease-in-dogs-and-cats,1384
content/pet-health/02-healthy-pet-weight-chart-at-home.md,"How to Track a Healthy Pet Weight at Home","healthy pet weight chart at home",healthy-pet-weight-chart-at-home,1282
content/pet-health/03-first-aid-kit-for-dogs-and-cats-checklist.md,"Pet First Aid Kit Checklist for Every Home","first aid kit for dogs and cats checklist",first-aid-kit-for-dogs-and-cats-checklist,1351
content/pet-health/04-when-to-visit-vet-for-pet-vomiting.md,"When to Visit a Vet for Pet Vomiting","when to visit vet for pet vomiting",when-to-visit-vet-for-pet-vomiting,1318
content/pet-health/05-natural-ways-to-support-pet-joint-health.md,"Natural Ways to Support Pet Joint Health","natural ways to support pet joint health",natural-ways-to-support-pet-joint-health,1314
content/pet-health/06-seasonal-allergies-in-pets-symptoms-and-relief.md,"Seasonal Allergies in Pets: Symptoms and Relief","seasonal allergies in pets symptoms and relief",seasonal-allergies-in-pets-symptoms-and-relief,1320
content/pet-health/07-how-to-check-pet-hydration-at-home.md,"How to Check Pet Hydration at Home","how to check pet hydration at home",how-to-check-pet-hydration-at-home,1308
content/pet-health/08-flea-allergy-dermatitis-in-pets-home-management.md,"Flea Allergy Dermatitis in Pets: Home Management","flea allergy dermatitis in pets home management",flea-allergy-dermatitis-in-pets-home-management,1315
content/pet-health/09-pet-skin-infection-signs-every-owner-should-know.md,"Pet Skin Infection Signs Every Owner Should Know","pet skin infection signs every owner should know",pet-skin-infection-signs-every-owner-should-know,1354
content/pet-health/10-emergency-pet-poisoning-steps-before-vet.md,"Emergency Pet Poisoning Steps Before the Vet","emergency pet poisoning steps before vet",emergency-pet-poisoning-steps-before-vet,1287
content/pet-health/11-early-signs-of-dehydration-in-pets-at-home.md,"Early signs of dehydration in pets at home","early signs of dehydration in pets at home",early-signs-of-dehydration-in-pets-at-home,1268
content/pet-health/12-how-to-check-pet-gum-color-for-health.md,"How to check pet gum color for health","how to check pet gum color for health",how-to-check-pet-gum-color-for-health,1266
content/pet-health/13-pet-fever-signs-when-to-call-the-vet.md,"Pet fever signs when to call the vet","pet fever signs when to call the vet",pet-fever-signs-when-to-call-the-vet,1273
content/pet-health/14-how-to-monitor-pet-breathing-rate-at-rest.md,"How to monitor pet breathing rate at rest","how to monitor pet breathing rate at rest",how-to-monitor-pet-breathing-rate-at-rest,1275
content/pet-health/15-best-home-recovery-setup-after-pet-surgery.md,"Best home recovery setup after pet surgery","best home recovery setup after pet surgery",best-home-recovery-setup-after-pet-surgery,1248
content/pet-health/16-pet-wound-cleaning-steps-before-vet-visit.md,"Pet wound cleaning steps before vet visit","pet wound cleaning steps before vet visit",pet-wound-cleaning-steps-before-vet-visit,1249
content/pet-health/17-how-to-detect-ear-infection-in-pets-early.md,"How to detect ear infection in pets early","how to detect ear infection in pets early",how-to-detect-ear-infection-in-pets-early,1272
content/pet-health/18-pet-constipation-home-care-and-warning-signs.md,"Pet constipation home care and warning signs","pet constipation home care and warning signs",pet-constipation-home-care-and-warning-signs,1242
content/pet-health/19-how-to-recognize-pain-in-dogs-and-cats.md,"How to recognize pain in dogs and cats","how to recognize pain in dogs and cats",how-to-recognize-pain-in-dogs-and-cats,1273
content/pet-health/20-pet-diarrhea-when-to-worry-and-act.md,"Pet diarrhea when to worry and act","pet diarrhea when to worry and act",pet-diarrhea-when-to-worry-and-act,1242
content/pet-health/21-how-to-keep-pets-hydrated-during-heat-waves.md,"How to keep pets hydrated during heat waves","how to keep pets hydrated during heat waves",how-to-keep-pets-hydrated-during-heat-waves,1273
content/pet-health/22-pet-allergy-symptoms-by-season-checklist.md,"Pet allergy symptoms by season checklist","pet allergy symptoms by season checklist",pet-allergy-symptoms-by-season-checklist,1227
content/pet-health/23-how-to-support-senior-pet-mobility-safely.md,"How to support senior pet mobility safely","how to support senior pet mobility safely",how-to-support-senior-pet-mobility-safely,1246
content/pet-health/24-pet-skin-rash-causes-and-first-home-steps.md,"Pet skin rash causes and first home steps","pet skin rash causes and first home steps",pet-skin-rash-causes-and-first-home-steps,1273
content/pet-health/25-how-to-spot-urinary-issues-in-cats-and-dogs.md,"How to spot urinary issues in cats and dogs","how to spot urinary issues in cats and dogs",how-to-spot-urinary-issues-in-cats-and-dogs,1298
content/pet-health/26-pet-first-aid-for-minor-cuts-and-scrapes.md,"Pet first aid for minor cuts and scrapes","pet first aid for minor cuts and scrapes",pet-first-aid-for-minor-cuts-and-scrapes,1266
content/pet-health/27-how-to-measure-pet-resting-heart-rate.md,"How to measure pet resting heart rate","how to measure pet resting heart rate",how-to-measure-pet-resting-heart-rate,1251
content/pet-health/28-pet-cough-warning-signs-and-vet-timeline.md,"Pet cough warning signs and vet timeline","pet cough warning signs and vet timeline",pet-cough-warning-signs-and-vet-timeline,1242
content/pet-health/29-how-to-reduce-stress-before-pet-vaccination-visit.md,"How to reduce stress before pet vaccination visit","how to reduce stress before pet vaccination visit",how-to-reduce-stress-before-pet-vaccination-visit,1273
content/pet-health/30-pet-obesity-warning-signs-and-home-action-plan.md,"Pet obesity warning signs and home action plan","pet obesity warning signs and home action plan",pet-obesity-warning-signs-and-home-action-plan,1275
